{
  "sessionId": "ses_2026_06_28_001",
  "projectId": "doughboy-vinyl-technologies",
  "objectiveId": "obj_checkout_004",
  "repository": "C:/Projects/doughboy-vinyl",
  "branch": "feat/checkout-redesign",
  "startedAt": "2026-06-28T18:42:00-05:00",
  "endedAt": null,
  "status": "active",
  "eventCount": 0
}
